{
  "schema_version": "m3.module_binding.v1",
  "registry_id": "m3_module_bindings_v1",
  "status": "contract_defined_core_bindings_present_profile_lock_adapter_pending",
  "future_active_root": "final_v0/M3_unified_preprocessing_and_signal_algorithms/src/m3_signal_core",
  "contract_authorities": {
    "m1_input_contract": "m1.signal_input.v2",
    "m1_config_contract": "m1.pipeline_config.v3",
    "m1_output_contract": "m1.inference_output.v3",
    "m2_dataset_version_id": "frailty3_m2_20260815_a054800abda272f6",
    "m2_fold_registry_id": "frailty3_future_corrected_sgkf5_v2",
    "m2_protocol_id": "frailty3_fixed_epoch_oof_v2_corrected_sgkf",
    "m3_preprocessing_registry_id": "m3_preprocessing_profiles_corrected_v1",
    "m3_physiology_registry_id": "m3_physiology_corrected_v1"
  },
  "bindings": [
    {
      "binding_id": "m3_quality_gate_corrected_v1",
      "module_role": "signal_quality_gate",
      "lifecycle": "future_active_core",
      "implementation_path": "final_v0/M3_unified_preprocessing_and_signal_algorithms/src/m3_signal_core/quality.py",
      "callable": "m3_signal_core.inspect_and_repair_signal",
      "exported_by": "final_v0/M3_unified_preprocessing_and_signal_algorithms/src/m3_signal_core/__init__.py",
      "profile_ids": [
        "frailty3_static_ppg_400_offline_v1",
        "frailty3_motion_ppg_400_offline_v1",
        "frailty3_peak_ppg_400_offline_v1",
        "frailty3_denoiser_ppg_400_offline_v1",
        "mobile_static_ppg_400_causal_v1",
        "mobile_motion_ppg_400_causal_v1",
        "mobile_peak_ppg_400_causal_v1",
        "imu_ekf_si_400_causal_v1",
        "imu_lpf_si_400_causal_v1"
      ],
      "algorithm_ids": [],
      "input_contract_ids": ["m1.signal_input.v2"],
      "output_contract_ids": ["m3.runtime.QualityAssessment.v1"],
      "runtime_dependencies": ["numpy"],
      "future_benchmark_allowed": false,
      "activation_gate": "core_callable_present_profile_locked_facade_required_before_M4",
      "description_zh": "执行通道、时间戳、非有限值、间隙、平坦与启发式裁剪风险检查，并仅对允许的短内部间隙做可追溯修复。核心 callable 已存在，但 benchmark 必须通过配置锁定适配层调用。",
      "description_en": "Checks channels, timestamps, non-finite values, gaps, flatlines and heuristic clipping risk, repairing only allowed short internal gaps with provenance. The core callable exists, but benchmarks must call it through a profile-locked adapter."
    },
    {
      "binding_id": "m3_ppg_preprocess_corrected_v1",
      "module_role": "ppg_preprocessing",
      "lifecycle": "future_active_profile_locked",
      "implementation_path": "final_v0/M3_unified_preprocessing_and_signal_algorithms/src/m3_signal_core/ppg.py",
      "callable": "m3_signal_core.preprocess_ppg",
      "exported_by": "final_v0/M3_unified_preprocessing_and_signal_algorithms/src/m3_signal_core/__init__.py",
      "profile_ids": [
        "frailty3_static_ppg_400_offline_v1",
        "frailty3_motion_ppg_400_offline_v1",
        "frailty3_peak_ppg_400_offline_v1",
        "frailty3_denoiser_ppg_400_offline_v1",
        "mobile_static_ppg_400_causal_v1",
        "mobile_motion_ppg_400_causal_v1",
        "mobile_peak_ppg_400_causal_v1"
      ],
      "algorithm_ids": [],
      "input_contract_ids": ["m1.signal_input.v2", "m3.preprocessing_profile.schema.v1"],
      "output_contract_ids": ["m3.runtime.PpgPreprocessResult", "m3.preprocessing_result.v1"],
      "runtime_dependencies": ["numpy", "scipy"],
      "future_benchmark_allowed": true,
      "activation_gate": "ready_for_future_benchmark",
      "description_zh": "按精确 profile_id 执行离线零相位或移动端因果 PPG 预处理，并分别保留 source_raw、repaired_raw 与 filtered 三层。旧根目录实现不在此绑定中。",
      "description_en": "Runs offline zero-phase or mobile causal PPG preprocessing by exact profile_id while retaining separate source_raw, repaired_raw and filtered layers. Repository-root implementations are excluded."
    },
    {
      "binding_id": "m3_external_ppg_resample_polyphase_v1",
      "module_role": "signal_resampling",
      "lifecycle": "future_active_profile_locked",
      "implementation_path": "final_v0/M3_unified_preprocessing_and_signal_algorithms/src/m3_signal_core/ppg.py",
      "callable": "m3_signal_core.resample_external_ppg_to_400",
      "exported_by": "final_v0/M3_unified_preprocessing_and_signal_algorithms/src/m3_signal_core/__init__.py",
      "profile_ids": ["external_ppg_to_400_polyphase_v1"],
      "algorithm_ids": [],
      "input_contract_ids": ["m2.external_dataset_registry.v1"],
      "output_contract_ids": ["m3.preprocessing_result.v1"],
      "runtime_dependencies": ["numpy", "scipy"],
      "future_benchmark_allowed": true,
      "activation_gate": "ready_for_future_benchmark",
      "description_zh": "通过 profile-locked facade 把外部 PTT PPG 的 256/500 Hz 信号显式多相映射到 400 Hz，并让 time、source_valid_mask 与峰标注共享同一索引映射。",
      "description_en": "Uses the profile-locked facade to map external PTT PPG from 256/500 Hz to 400 Hz by polyphase resampling with one shared mapping for time, source_valid_mask and peak annotations."
    },
    {
      "binding_id": "m3_imu_ekf_primary_v1",
      "module_role": "imu_preprocessing",
      "lifecycle": "future_active_profile_locked",
      "implementation_path": "final_v0/M3_unified_preprocessing_and_signal_algorithms/src/m3_signal_core/imu_runtime.py",
      "callable": "m3_signal_core.preprocess_imu",
      "exported_by": "final_v0/M3_unified_preprocessing_and_signal_algorithms/src/m3_signal_core/__init__.py",
      "profile_ids": ["imu_ekf_si_400_causal_v1"],
      "algorithm_ids": ["ekf"],
      "input_contract_ids": ["m1.signal_input.v2", "m3.preprocessing_profile.schema.v1"],
      "output_contract_ids": ["m3.runtime.ImuPreprocessResult", "m3.preprocessing_result.v1"],
      "runtime_dependencies": ["numpy", "scipy"],
      "future_benchmark_allowed": true,
      "activation_gate": "ready_for_future_benchmark",
      "description_zh": "D5 主路线：无预校准四元数误差状态 EKF，以显式 SI 单位输出重力、动态加速度、陀螺与向量 jerk；就绪失败时显式 no_estimate。",
      "description_en": "D5 primary route: no-precalibration quaternion error-state EKF emitting gravity, dynamic acceleration, gyro and vector jerk in explicit SI units; readiness failure returns explicit no_estimate."
    },
    {
      "binding_id": "m3_imu_lpf_comparator_v1",
      "module_role": "imu_preprocessing",
      "lifecycle": "future_active_profile_locked",
      "implementation_path": "final_v0/M3_unified_preprocessing_and_signal_algorithms/src/m3_signal_core/imu_runtime.py",
      "callable": "m3_signal_core.preprocess_imu",
      "exported_by": "final_v0/M3_unified_preprocessing_and_signal_algorithms/src/m3_signal_core/__init__.py",
      "profile_ids": ["imu_lpf_si_400_causal_v1"],
      "algorithm_ids": ["lpf_0p3"],
      "input_contract_ids": ["m1.signal_input.v2", "m3.preprocessing_profile.schema.v1"],
      "output_contract_ids": ["m3.runtime.ImuPreprocessResult", "m3.preprocessing_result.v1"],
      "runtime_dependencies": ["numpy", "scipy"],
      "future_benchmark_allowed": true,
      "activation_gate": "ready_for_future_benchmark",
      "description_zh": "D5 对照路线：0.3 Hz 二阶低通重力估计，与 EKF 使用相同输入/输出合同；不得作为 EKF 的静默回退。",
      "description_en": "D5 comparator: second-order 0.3 Hz low-pass gravity estimate using the same input/output contract as EKF; never a silent EKF fallback."
    },
    {
      "binding_id": "m3_peak_corrected_v1",
      "module_role": "peak_detection",
      "lifecycle": "future_active_profile_locked",
      "implementation_path": "final_v0/M3_unified_preprocessing_and_signal_algorithms/src/m3_signal_core/physiology.py",
      "callable": "m3_signal_core.detect_peaks_corrected",
      "exported_by": "final_v0/M3_unified_preprocessing_and_signal_algorithms/src/m3_signal_core/__init__.py",
      "profile_ids": ["frailty3_peak_ppg_400_offline_v1", "mobile_peak_ppg_400_causal_v1"],
      "algorithm_ids": ["m3_peak_corrected_v1"],
      "input_contract_ids": ["m3.preprocessing_result.v1"],
      "output_contract_ids": ["m3.runtime.PeakResult", "m3.physiology_result.v1"],
      "runtime_dependencies": ["numpy", "scipy"],
      "future_benchmark_allowed": true,
      "activation_gate": "ready_for_future_benchmark",
      "description_zh": "通过 profile-locked facade 在 RED/IR 各自的 0.4–8 Hz 峰输入上执行双极性、滑窗、重叠去重与 PPI 有效性检查；只接受两个 purpose=peak_detection_input 配置。",
      "description_en": "Uses the profile-locked facade for bipolar windowed detection, overlap deduplication and PPI validity on each RED/IR 0.4–8 Hz input; only the two purpose=peak_detection_input profiles are accepted."
    },
    {
      "binding_id": "m3_dual_channel_selector_v1",
      "module_role": "dual_channel_selection",
      "lifecycle": "future_active_core",
      "implementation_path": "final_v0/M3_unified_preprocessing_and_signal_algorithms/src/m3_signal_core/physiology.py",
      "callable": "m3_signal_core.choose_primary_channel",
      "exported_by": "final_v0/M3_unified_preprocessing_and_signal_algorithms/src/m3_signal_core/__init__.py",
      "profile_ids": ["frailty3_peak_ppg_400_offline_v1", "mobile_peak_ppg_400_causal_v1"],
      "algorithm_ids": ["m3_dual_channel_selection_v1"],
      "input_contract_ids": ["m3.runtime.PeakResult"],
      "output_contract_ids": ["m3.physiology_result.v1"],
      "runtime_dependencies": ["numpy"],
      "future_benchmark_allowed": false,
      "activation_gate": "core_callable_present_profile_locked_facade_required_before_M4",
      "description_zh": "RED/IR 独立检测后按有效状态与 SQI 选择主通道，平局固定 RED；不生成共识峰。",
      "description_en": "Selects RED or IR after independent detection using validity then SQI, with deterministic RED tie-break; it never creates consensus peaks."
    },
    {
      "binding_id": "m3_dual_channel_agreement_v1",
      "module_role": "dual_channel_selection",
      "lifecycle": "future_active_core",
      "implementation_path": "final_v0/M3_unified_preprocessing_and_signal_algorithms/src/m3_signal_core/physiology.py",
      "callable": "m3_signal_core.dual_channel_agreement",